{
  "analysis_id": "e28949cd-9325-4767-bb44-43d425f78061",
  "canonical_grid": {
    "aoi_geometry_4326": {
      "coordinates": [
        [
          [
            -83.15,
            42.55
          ],
          [
            -83.15,
            42.65
          ],
          [
            -83.3,
            42.65
          ],
          [
            -83.3,
            42.55
          ],
          [
            -83.15,
            42.55
          ]
        ]
      ],
      "type": "Polygon"
    },
    "bounds_geographic": [
      -83.30373235974541,
      42.547040269139046,
      -83.14646886073179,
      42.65297215382107
    ],
    "bounds_projected": [
      311160.0,
      4713080.0,
      323770.0,
      4724520.0
    ],
    "crs": "EPSG:32617",
    "epsg": 32617,
    "height": 1144,
    "resolution": [
      10.0,
      10.0
    ],
    "schema_version": "1.0.0",
    "signature": "EPSG:32617:1261x1144:10,0,311160,0,-10,4.72452e+06",
    "transform": [
      10.0,
      0.0,
      311160.0,
      0.0,
      -10.0,
      4724520.0
    ],
    "width": 1261
  },
  "created_at": "2026-08-03T16:40:16.783477+00:00",
  "data_source": {
    "collection": "sentinel-2-l2a",
    "license": "Copernicus Sentinel data terms",
    "provider": "Microsoft Planetary Computer",
    "stac_endpoint": "https://planetarycomputer.microsoft.com/api/stac/v1"
  },
  "outputs": [
    {
      "artifact_type": "ndvi_cog",
      "content_type": "image/tiff",
      "path": "analyses/e28949cd-9325-4767-bb44-43d425f78061/scenes/S2B_MSIL2A_20240413T161829_R040_T17TLH_20240413T202718/ndvi.tif",
      "scene_item_id": "S2B_MSIL2A_20240413T161829_R040_T17TLH_20240413T202718",
      "sha256": "afcb5e2c8880b0aea92f43dbcac447adf993f0ba5db5b13bbc1ab0a9ce8e7559",
      "size_bytes": 6423777
    },
    {
      "artifact_type": "ndvi_preview",
      "content_type": "image/png",
      "path": "analyses/e28949cd-9325-4767-bb44-43d425f78061/scenes/S2B_MSIL2A_20240413T161829_R040_T17TLH_20240413T202718/ndvi_preview.png",
      "scene_item_id": "S2B_MSIL2A_20240413T161829_R040_T17TLH_20240413T202718",
      "sha256": "8d09651ca933b8eb180dd2f1c08d6ad82f469583536e1237e53d9bad027c47c0",
      "size_bytes": 1005856
    },
    {
      "artifact_type": "scene_summary",
      "content_type": "application/json",
      "path": "analyses/e28949cd-9325-4767-bb44-43d425f78061/scenes/S2B_MSIL2A_20240413T161829_R040_T17TLH_20240413T202718/summary.json",
      "scene_item_id": "S2B_MSIL2A_20240413T161829_R040_T17TLH_20240413T202718",
      "sha256": "ca0c7a161a188ce8ccf60cd87f2b1d954ef0a17be6de1683e5afa34f69d4f941",
      "size_bytes": 5546
    },
    {
      "artifact_type": "true_color_preview",
      "content_type": "image/png",
      "path": "analyses/e28949cd-9325-4767-bb44-43d425f78061/scenes/S2B_MSIL2A_20240413T161829_R040_T17TLH_20240413T202718/true_color.png",
      "scene_item_id": "S2B_MSIL2A_20240413T161829_R040_T17TLH_20240413T202718",
      "sha256": "22cc63fc6f12d6b0dcb0565d9952b4a27dbc8614fbf7373d7408e55a94bec44e",
      "size_bytes": 1025699
    },
    {
      "artifact_type": "ndvi_cog",
      "content_type": "image/tiff",
      "path": "analyses/e28949cd-9325-4767-bb44-43d425f78061/scenes/S2A_MSIL2A_20240531T162841_R083_T17TLH_20240601T010652/ndvi.tif",
      "scene_item_id": "S2A_MSIL2A_20240531T162841_R083_T17TLH_20240601T010652",
      "sha256": "3789a356bedfe0a085011cbac19356e45ac2367b094ec8051dcdd98b7d35e8f9",
      "size_bytes": 6349453
    },
    {
      "artifact_type": "ndvi_preview",
      "content_type": "image/png",
      "path": "analyses/e28949cd-9325-4767-bb44-43d425f78061/scenes/S2A_MSIL2A_20240531T162841_R083_T17TLH_20240601T010652/ndvi_preview.png",
      "scene_item_id": "S2A_MSIL2A_20240531T162841_R083_T17TLH_20240601T010652",
      "sha256": "253003202a1e53e42c645ba539cdf2817c471a26caa0b5923a20056e00c5c570",
      "size_bytes": 992075
    },
    {
      "artifact_type": "scene_summary",
      "content_type": "application/json",
      "path": "analyses/e28949cd-9325-4767-bb44-43d425f78061/scenes/S2A_MSIL2A_20240531T162841_R083_T17TLH_20240601T010652/summary.json",
      "scene_item_id": "S2A_MSIL2A_20240531T162841_R083_T17TLH_20240601T010652",
      "sha256": "de51abae14ffb33974317d0a90a4cf96da043375a06f90fa53bd21b9ca49342e",
      "size_bytes": 5565
    },
    {
      "artifact_type": "true_color_preview",
      "content_type": "image/png",
      "path": "analyses/e28949cd-9325-4767-bb44-43d425f78061/scenes/S2A_MSIL2A_20240531T162841_R083_T17TLH_20240601T010652/true_color.png",
      "scene_item_id": "S2A_MSIL2A_20240531T162841_R083_T17TLH_20240601T010652",
      "sha256": "ebb8ee78031d8bd8336059195e153cb05c220249493bc30830cd08301e774b7b",
      "size_bytes": 1019674
    },
    {
      "artifact_type": "ndvi_cog",
      "content_type": "image/tiff",
      "path": "analyses/e28949cd-9325-4767-bb44-43d425f78061/scenes/S2B_MSIL2A_20240612T161829_R040_T17TLH_20240612T221210/ndvi.tif",
      "scene_item_id": "S2B_MSIL2A_20240612T161829_R040_T17TLH_20240612T221210",
      "sha256": "026ebdca6b350835a11d50ac05fdd687c3d5a29e1e8e021030fd21c967b23f41",
      "size_bytes": 6366655
    },
    {
      "artifact_type": "ndvi_preview",
      "content_type": "image/png",
      "path": "analyses/e28949cd-9325-4767-bb44-43d425f78061/scenes/S2B_MSIL2A_20240612T161829_R040_T17TLH_20240612T221210/ndvi_preview.png",
      "scene_item_id": "S2B_MSIL2A_20240612T161829_R040_T17TLH_20240612T221210",
      "sha256": "ebacca234b3f7307d8ba304bc75481bc72c9f41e935c04492ea6729fe4141f07",
      "size_bytes": 998158
    },
    {
      "artifact_type": "scene_summary",
      "content_type": "application/json",
      "path": "analyses/e28949cd-9325-4767-bb44-43d425f78061/scenes/S2B_MSIL2A_20240612T161829_R040_T17TLH_20240612T221210/summary.json",
      "scene_item_id": "S2B_MSIL2A_20240612T161829_R040_T17TLH_20240612T221210",
      "sha256": "b6c7bb573563bdb4db7d04420b2914788b46c1d9f7fc8ff1915a50dc1d60fb81",
      "size_bytes": 5558
    },
    {
      "artifact_type": "true_color_preview",
      "content_type": "image/png",
      "path": "analyses/e28949cd-9325-4767-bb44-43d425f78061/scenes/S2B_MSIL2A_20240612T161829_R040_T17TLH_20240612T221210/true_color.png",
      "scene_item_id": "S2B_MSIL2A_20240612T161829_R040_T17TLH_20240612T221210",
      "sha256": "ec05d761ae243e320833fe3d900d80854bd3b63eba7d9dfbb20acc7731fbaa7c",
      "size_bytes": 1030986
    },
    {
      "artifact_type": "ndvi_cog",
      "content_type": "image/tiff",
      "path": "analyses/e28949cd-9325-4767-bb44-43d425f78061/scenes/S2A_MSIL2A_20240727T161831_R040_T17TLH_20240727T233652/ndvi.tif",
      "scene_item_id": "S2A_MSIL2A_20240727T161831_R040_T17TLH_20240727T233652",
      "sha256": "9cc921f6da05ba1cf8c713c06dc20f7e9ac01b91db79c700151d32f5d375dbed",
      "size_bytes": 6353027
    },
    {
      "artifact_type": "ndvi_preview",
      "content_type": "image/png",
      "path": "analyses/e28949cd-9325-4767-bb44-43d425f78061/scenes/S2A_MSIL2A_20240727T161831_R040_T17TLH_20240727T233652/ndvi_preview.png",
      "scene_item_id": "S2A_MSIL2A_20240727T161831_R040_T17TLH_20240727T233652",
      "sha256": "4f8dd5f0e190d5a83ed618bce71045b100b8513b5e0f40e050c69b670a4d490f",
      "size_bytes": 1004471
    },
    {
      "artifact_type": "scene_summary",
      "content_type": "application/json",
      "path": "analyses/e28949cd-9325-4767-bb44-43d425f78061/scenes/S2A_MSIL2A_20240727T161831_R040_T17TLH_20240727T233652/summary.json",
      "scene_item_id": "S2A_MSIL2A_20240727T161831_R040_T17TLH_20240727T233652",
      "sha256": "add6ae92dd5e879acb7bf2e9333db04ec87a058417a1c84ec8435572f97313d9",
      "size_bytes": 5572
    },
    {
      "artifact_type": "true_color_preview",
      "content_type": "image/png",
      "path": "analyses/e28949cd-9325-4767-bb44-43d425f78061/scenes/S2A_MSIL2A_20240727T161831_R040_T17TLH_20240727T233652/true_color.png",
      "scene_item_id": "S2A_MSIL2A_20240727T161831_R040_T17TLH_20240727T233652",
      "sha256": "2a86195a562493878eebb82b01a98925cfcc9f6f8a5019b3fc92ea74305c557b",
      "size_bytes": 1016119
    },
    {
      "artifact_type": "ndvi_cog",
      "content_type": "image/tiff",
      "path": "analyses/e28949cd-9325-4767-bb44-43d425f78061/scenes/S2B_MSIL2A_20240824T162829_R083_T17TLH_20240824T204911/ndvi.tif",
      "scene_item_id": "S2B_MSIL2A_20240824T162829_R083_T17TLH_20240824T204911",
      "sha256": "a003a9dc1a6826a8b1452ca4f56e3add68c86a262056dde44deb66291b736a8b",
      "size_bytes": 6256222
    },
    {
      "artifact_type": "ndvi_preview",
      "content_type": "image/png",
      "path": "analyses/e28949cd-9325-4767-bb44-43d425f78061/scenes/S2B_MSIL2A_20240824T162829_R083_T17TLH_20240824T204911/ndvi_preview.png",
      "scene_item_id": "S2B_MSIL2A_20240824T162829_R083_T17TLH_20240824T204911",
      "sha256": "78b55c76bd36847dd978ee01c544d1772117620b915076f1250ab9f49ad1a6ea",
      "size_bytes": 974813
    },
    {
      "artifact_type": "scene_summary",
      "content_type": "application/json",
      "path": "analyses/e28949cd-9325-4767-bb44-43d425f78061/scenes/S2B_MSIL2A_20240824T162829_R083_T17TLH_20240824T204911/summary.json",
      "scene_item_id": "S2B_MSIL2A_20240824T162829_R083_T17TLH_20240824T204911",
      "sha256": "2c53eca1c1d597395f5aa68ce01750b9c965b9274f0c1398b36af5852634507a",
      "size_bytes": 5562
    },
    {
      "artifact_type": "true_color_preview",
      "content_type": "image/png",
      "path": "analyses/e28949cd-9325-4767-bb44-43d425f78061/scenes/S2B_MSIL2A_20240824T162829_R083_T17TLH_20240824T204911/true_color.png",
      "scene_item_id": "S2B_MSIL2A_20240824T162829_R083_T17TLH_20240824T204911",
      "sha256": "fd3f81de85caac97e523921926ea455d259e17a44b5b0a24104ff90e761fc2dc",
      "size_bytes": 975490
    },
    {
      "artifact_type": "ndvi_cog",
      "content_type": "image/tiff",
      "path": "analyses/e28949cd-9325-4767-bb44-43d425f78061/scenes/S2A_MSIL2A_20241005T162141_R040_T17TLH_20241005T220355/ndvi.tif",